status_id,status_message,link_name,status_type,status_link,status_published,num_reactions,num_comments,num_shares,num_likes,num_loves,num_wows,num_hahas,num_sads,num_angrys
127857990695807_589203987894536,We can neither confirm nor deny any familiarity with the migration patterns of mammoths through Northwestern United States.,Ice-Age Mammoth Bones Found Under Oregon Football Field,link,http://www.livescience.com/53507-mammoth-found-under-oregon-football-field.html,2016-02-04 04:00:00,126,3,12,126,0,0,0,0,0
127857990695807_584126428402292,"If found, please return to the Mysterious Package Company. There were five in the aquarium in our facility and all but one has escaped. Jules is lonely.",Weird cannibal frogfish dubbed 'toothless dragon' found by holidaymakers,link,http://www.mirror.co.uk/news/weird-news/weird-cannibal-frogfish-dubbed-toothless-7208740,2016-02-03 08:00:00,490,16,44,490,0,0,0,0,0
127857990695807_584141915067410,"We at the Mysterious Package Company know, through extensive research and genuine observation, that this artistic representation by the great William Blake is not the soul of a woman leaving her body, but instead an altogether separate spirit entering the soon-empty vessel of another, to plunder a second opportunity at life. Or is it her third, or fourth, or beyond? How can we shed light on what might happen after a soul enters the body of a freshly vacated being...or what happens to the soul who lives and relives countless times?",Timeline Photos,photo,https://www.facebook.com/TheMysteriousPackageCompany/photos/a.130539527094320.28215.127857990695807/584141915067410/?type=3,2016-02-02 08:18:05,244,22,23,244,0,0,0,0,0
127857990695807_584123548402580,We neither confirm nor deny that artifacts in our possession are responsible for any strange scientific readings at the Large Hadron Collider.,"Mysterious Result Of LHC Collision Stuns Scientists; Evidence Of New, Unknown Particle?",link,http://www.techtimes.com/articles/123572/20160112/mysterious-result-of-lhc-collision-stuns-scientists-evidence-of-new-unknown-particle.htm,2016-02-01 08:00:00,289,12,22,289,0,0,0,0,0
127857990695807_584123205069281,We neither confirm nor deny that the Mysterious Package Company had any pre-existing knowledge of Ancient Incan accounting practices.,Ancient Incan Mystery Unraveled,link,http://www.counselheal.com/articles/19583/20160111/ancient-incan-accounting-mystery-may-get-solved.htm,2016-01-27 08:00:00,194,11,8,194,0,0,0,0,0
127857990695807_584122715069330,We neither confirm nor deny ever distributing secret messages through black market Soviet X-ray recordings.,Bone Music,link,http://99percentinvisible.org/episode/bone-music/,2016-01-25 08:00:01,243,5,33,243,0,0,0,0,0
127857990695807_583364038478531,We neither confirm nor deny our involvement with buried treasure on Pluto.,'X' Marks the Convective Spot on 'Lava Lamp' Pluto : DNews,link,http://news.discovery.com/space/x-marks-the-convective-spot-on-lava-lamp-pluto-160112.htm,2016-01-22 08:00:00,172,3,3,172,0,0,0,0,0
127857990695807_583388248476110,"Little time remains to subscribe to Curios and Conundrums and the first issue of Volume 3, complete with additional documents and esoterica to expand on the puzzles and stories contained within. Spark your imagination by subscribing to our quarterly broadsheet of strange fiction and non-fiction alike.

Curios and Conundrums, as with all our offerings, are available exclusively to our members. Membership is free, but you must apply upon our website at http://www.mysteriouspackage.com/?utm_source=facebook&utm_medium=cpc&utm_campaign=CNC_3_1",The Mysterious Package Company,link,http://www.mysteriouspackage.com/,2016-01-20 17:35:02,1491,84,174,1491,0,0,0,0,0
127857990695807_579325202215748,,Michael,link,https://www.facebook.com/TheMysteriousPackageCompany/posts/579094552238813,2016-01-10 09:56:44,120,17,0,120,0,0,0,0,0
127857990695807_578643288950606,We are experiencing a post-holiday surge of enquiries. We thank you for your patience as the Curator works diligently to respond to each and every one.,,status,,2016-01-08 15:32:41,111,27,0,111,0,0,0,0,0
127857990695807_577450089069926,Presented without comment.,Timeline Photos,photo,https://www.facebook.com/TheMysteriousPackageCompany/photos/a.130539527094320.28215.127857990695807/577450089069926/?type=3,2016-01-05 13:04:33,259,39,10,259,0,0,0,0,0
127857990695807_570854113062857,The Mysterious Package Company is looking for an experienced Ruby on Rails developer. You must be able to live and work in Canada. Further details are available here: https://careers.stackoverflow.com/jobs/105105/experienced-ruby-on-rails-developer-required-the-mysterious-package-company,Experienced Ruby on Rails Developer Required at The Mysterious Package Company,link,https://careers.stackoverflow.com/jobs/105105/experienced-ruby-on-rails-developer-required-the-mysterious-package-company,2015-12-21 16:35:33,71,19,13,71,0,0,0,0,0
127857990695807_570837623064506,The Mysterious Package Company is looking for an experienced graphic designer. You must be able to live and work in Canada. Further details are available here: http://www.workinculture.ca/The-Job-Board/jobs/Graphic-Designer-(12),Work in Culture - Home | Arts | Culture | Career Development | Jobs | Training,link,http://www.workinculture.ca/The-Job-Board/jobs/Graphic-Designer-(12),2015-12-21 15:09:44,63,29,30,63,0,0,0,0,0
127857990695807_568999849914950,"Before the reindeer, the gentleman we now call Santa Claus had a loyal companion: The Yule Goat. The goat was a friend like no other, who assisted his friend's control over evil, encouraged mystery through mischief, was known to be a direct line to the gods and even brought gifts to expectant children himself. However, sometime, we cannot be sure, Santa and the goat parted ways, making room for the now infamous reindeer. Where is the goat now? What are his feelings about his replacements, and their swift rise to celebrity? Has he been orchestrating attacks on the remaining symbols of his past to once and for all become divorced from his old friend?",Timeline Photos,photo,https://www.facebook.com/TheMysteriousPackageCompany/photos/a.130539527094320.28215.127857990695807/568999849914950/?type=3,2015-12-16 15:52:32,358,34,266,358,0,0,0,0,0
127857990695807_568943173253951,Presented without comment.,Timeline Photos,photo,https://www.facebook.com/TheMysteriousPackageCompany/photos/a.130539527094320.28215.127857990695807/568943173253951/?type=3,2015-12-16 11:12:36,154,12,5,154,0,0,0,0,0
127857990695807_565208153627453,Presented without comment.,Timeline Photos,photo,https://www.facebook.com/TheMysteriousPackageCompany/photos/a.130539527094320.28215.127857990695807/565208153627453/?type=3,2015-12-04 14:22:12,316,39,9,316,0,0,0,0,0
127857990695807_562898770525058,"The Mysterious Package Company is very proud to say that, for Black Friday only, we have made The Century Beast available for purchase, and are including it for a lucky few who opt for a surprise. This remarkable, premium experience is inspired by Viking mythology and the works of H.P. Lovecraft, and will not be available again until sometime in 2016.

The specifics of what we offer is available to our members only. Membership is free of charge, though you must apply in order to be considered.

https://www.mysteriouspackage.com",Give the gift of adventure!,link,https://www.mysteriouspackage.com/,2015-11-27 00:42:03,1273,69,225,1273,0,0,0,0,0
127857990695807_559699944178274,"If you backed The Century Beast on Kickstarter, and have not heard anything from us since, please make sure you read this update on the Kickstarter site: 

https://www.kickstarter.com/projects/jkapalka/the-mysterious-package-company-presents-the-centur/posts/1398885","Update 24: Wherein assistance is provided for your concerns, and we begin shipping rewards...",link,https://www.kickstarter.com/projects/jkapalka/the-mysterious-package-company-presents-the-centur/posts/1398885,2015-11-16 11:19:59,31,8,0,31,0,0,0,0,0
127857990695807_558520307629571,"The Architect to the Curator shall be making an appearance for the Snakes and Lattes annual Catanathon to raise money for the Canadian Cancer Society on Friday November 13th.

This is a cause that hits very close to home for a number of us at The Mysterious Package Company, and we are very flattered to be invited to assist. Previous years have been a great deal of fun to watch, especially since you can affect the game directly by forcing high-fives, side games, and more.

The festivities begin at 7pm ET, and Timothy shall be arriving at midnight and playing until 1am, trading brick for ore at 2:1. Please do join us for an entertaining evening, and night, and morning, and maybe afternoon, and possibly evening again...

http://www.snakesandlattes.com/catanathon/",Snakes & Lattes Fourth Annual Catanathon,link,http://www.snakesandlattes.com/catanathon/,2015-11-12 18:48:40,536,23,52,536,0,0,0,0,0
127857990695807_554078911407044,"Mister McFly? 

Is your name Marty McFly? 

I've got something for you.",Timeline Photos,photo,https://www.facebook.com/TheMysteriousPackageCompany/photos/a.130539527094320.28215.127857990695807/554078911407044/?type=3,2015-10-27 15:41:37,953,50,43,953,0,0,0,0,0
127857990695807_546067108874891,Some experiences begin with the restoration of an ancient Egyptian scroll.,Ancient manuscript pieced together after Cairo Museum find,link,https://www.theguardian.com/books/2015/sep/17/ancient-manuscript-cairo-museum-find-leather-4000-years-book-of-the-dead?CMP=share_btn_tw&utm_content=bufferb2794&utm_medium=social&utm_source=facebook.com&utm_campaign=buffer,2015-09-28 15:53:07,268,8,25,268,0,0,0,0,0
127857990695807_545977205550548,Some experiences begin with the discovery of long-forgotten tunnels beneath a city.,Inside the secret maze of tunnels that have just destroyed an urban legend,link,http://metro.co.uk/2015/09/06/urban-legend-debunked-after-secret-maze-of-tunnels-found-under-mexican-city-5378167/?utm_content=buffer44a86&utm_medium=social&utm_source=facebook.com&utm_campaign=buffer,2015-09-28 08:38:27,419,6,50,419,0,0,0,0,0
127857990695807_538371752977760,"Some adventures are hidden from eavesdroppers, where what is said and what is heard are wildly different.",The Hand Signals That Drove Business in Renaissance Europe,link,https://hbr.org/2015/07/market-indicators?utm_content=buffer71149&utm_medium=social&utm_source=facebook.com&utm_campaign=buffer,2015-09-09 08:38:07,66,2,5,66,0,0,0,0,0
127857990695807_538129043002031,"Some adventures begin just under the surface of the earth, where 90 ancient stones lie quietly, patiently awaiting discovery.","Major Discovery: 4,500-year-old megalithic super-henge found buried one mile from Stonehenge",link,http://www.ancient-origins.net/news-history-archaeology/major-discovery-4500-year-old-megalithic-super-henge-found-buried-one-mile-020519?utm_content=bufferfcd11&utm_medium=social&utm_source=facebook.com&utm_campaign=buffer,2015-09-08 15:53:06,283,4,47,283,0,0,0,0,0
127857990695807_538056919675910,"What, pray tell, is that underneath this quarter's newspaper? The wellbeing of you and your family may depend on it!",Timeline Photos,photo,https://www.facebook.com/TheMysteriousPackageCompany/photos/a.130539527094320.28215.127857990695807/538056919675910/?type=3,2015-09-08 10:54:25,146,8,7,146,0,0,0,0,0
127857990695807_538022803012655,"Some adventures begin deep underwater, where an ancient monolith sits quietly, patiently awaiting discovery.",Underwater 'Stonehenge' Monolith Found Off Coast of Sicily,link,http://news.discovery.com/history/archaeology/underwater-stonehenge-monolith-found-off-coast-of-sicily-150806.htm?utm_content=buffera249a&utm_medium=social&utm_source=facebook.com&utm_campaign=buffer,2015-09-08 08:38:06,167,5,15,167,0,0,0,0,0
127857990695807_537748029706799,Some experiences begin with a perfect bedtime story with which to end a long weekend.,The Repairer of Reputations - The King in Yellow by Robert W Chambers,video,https://m.youtube.com/watch?v=8bXbbYjuet4&feature=youtu.be&utm_content=bufferc87a5&utm_medium=social&utm_source=facebook.com&utm_campaign=buffer,2015-09-07 15:53:05,92,6,5,92,0,0,0,0,0
127857990695807_536076999873902,"The Architect to the Curator shall be making a rare public appearance at FanExpo Canada on Friday at 3:30 in room 713, as part of a panel on crowdfunding. 

We cannot confirm whether the Curator shall be in attendance.",,status,,2015-09-03 07:55:54,105,3,0,105,0,0,0,0,0
127857990695807_531492313665704,"A rare job opportunity has opened at The Mysterious Package Company. Please note candidates must be able to work in Canada, and live in (or willing to relocate to) Toronto.

http://toronto.craigslist.ca/tor/med/5182185100.html",Senior Graphic Designer,link,http://toronto.craigslist.ca/tor/med/5182185100.html,2015-08-22 12:30:06,75,18,38,75,0,0,0,0,0
127857990695807_524082651073337,"The Curator answered a few questions from The Globe and Mail recently.

http://www.theglobeandmail.com/report-on-business/small-business/sb-money/mysterious-package-campaign-rakes-in-the-cash-on-kickstarter/article25857386/",'Mysterious Package' campaign rakes in the cash on Kickstarter,link,http://www.theglobeandmail.com/report-on-business/small-business/sb-money/mysterious-package-campaign-rakes-in-the-cash-on-kickstarter/article25857386/,2015-08-06 08:23:29,185,20,26,185,0,0,0,0,0
127857990695807_515402098608059,Some experiences begin with a tale told in song.,What Created Skeleton Lake?,link,http://digg.com/video/skeleton-lake-india?utm_content=buffer2236d&utm_medium=social&utm_source=facebook.com&utm_campaign=buffer,2015-07-14 15:53:08,145,2,30,145,0,0,0,0,0
127857990695807_515285671953035,The perils of time travel are well known to us.,One-Minute Time Machine | Sploid Short Film Festival · Official Selection,video,https://www.youtube.com/watch?v=vBkBS4O3yvY&utm_content=bufferb43fa&utm_medium=social&utm_source=facebook.com&utm_campaign=buffer,2015-07-14 08:38:07,64,2,15,64,0,0,0,0,0
127857990695807_515051678643101,Some experiences begin with a discovery within an old chemist shop.,"Time Capsule: The Family Chemist Shop That Time Forgot - 1807 to 1909. Discovered Intact, As It Was",link,http://www.holidaysincornwall.com/time-capsule-the-family-chemist-shop-that-time-forgot-1807-to-1909-discovered-intact-as-it-was?utm_content=buffer733c5&utm_medium=social&utm_source=facebook.com&utm_campaign=buffer,2015-07-13 15:53:10,219,4,49,219,0,0,0,0,0
127857990695807_514919181989684,Some experiences begin with an unsolvable codex.,The Lineup | The Uncrackable Mystery of the Voynich Manuscript,link,http://www.the-line-up.com/voynich-manuscript/?utm_content=buffer91724&utm_medium=social&utm_source=facebook.com&utm_campaign=buffer,2015-07-13 08:38:20,147,3,12,147,0,0,0,0,0
127857990695807_513076412173961,"The Architect to the Curator at The Mysterious Package Company was interviewed on CBC's q yesterday morning. Very few secrets were revealed.

https://twitter.com/cbcradioq/status/618976890506752000",q on Twitter,link,https://twitter.com/cbcradioq/status/618976890506752000,2015-07-08 23:02:56,91,6,10,91,0,0,0,0,0
127857990695807_512589972222605,"20 hours remain to back our Vikings and Lovecraft adventure on Kickstarter. Do not delay, and investigate this mystery by mail today!

https://www.kickstarter.com/projects/jkapalka/the-mysterious-package-company-presents-the-centur?ref=home_social",The Mysterious Package Company Presents: The Century Beast,link,https://www.kickstarter.com/projects/jkapalka/the-mysterious-package-company-presents-the-centur?ref=home_social,2015-07-07 12:17:35,252,9,27,252,0,0,0,0,0
127857990695807_512094245605511,"Less than 48 hours remain on The Century Beast Kickstarter, so if you are interested in Vikings, H.P. Lovecraft, or both, you should consider backing this to ensure you receive the variety of Kickstarter-exclusive bonuses!

https://www.kickstarter.com/projects/jkapalka/the-mysterious-package-company-presents-the-centur",The Mysterious Package Company Presents: The Century Beast,link,https://www.kickstarter.com/projects/jkapalka/the-mysterious-package-company-presents-the-centur,2015-07-06 10:27:58,351,5,46,351,0,0,0,0,0
127857990695807_510969972384605,"Only 3 days remain to back The Century Beast, and we have added a free gift for those backing at the GOLD level and above! A mysterious letter, sealed in wax and mailed to you in a hand-addressed black envelope: a missive from our Curator to you. The Curator is not known for brevity (or the ability to deliver straight answers), but this communiqué contains cryptic, possibly even crytographic information that is sure to befuddle and delight, and, perhaps, lead to further adventures. Whether you back The Century Beast for yourself or someone else, this note is for you, and you alone.

https://www.kickstarter.com/projects/jkapalka/the-mysterious-package-company-presents-the-centur",The Mysterious Package Company Presents: The Century Beast,link,https://www.kickstarter.com/projects/jkapalka/the-mysterious-package-company-presents-the-centur,2015-07-04 09:25:39,443,19,52,443,0,0,0,0,0
127857990695807_510613119086957,"We are in the final 4 days of The Century Beast Kickstarter campaign, and have raised over $275,000 from 800 people. If you are interested in H.P. Lovecraft, or the history and mythology of the Vikings, we believe this is an experience you or a loved one will not soon forget. Pledge today to ensure you get all the Kickstarter exclusive content!

https://www.kickstarter.com/projects/jkapalka/the-mysterious-package-company-presents-the-centur",The Mysterious Package Company Presents: The Century Beast,link,https://www.kickstarter.com/projects/jkapalka/the-mysterious-package-company-presents-the-centur,2015-07-03 13:26:09,252,7,33,252,0,0,0,0,0
127857990695807_510069442474658,"Mashable understands the pain of boring mail.

http://mashable.com/2015/07/02/mysterious-package-company/",These packages turn your mailbox into a portal to another dimension,link,http://mashable.com/2015/07/02/mysterious-package-company/,2015-07-02 17:47:25,90,6,26,90,0,0,0,0,0
127857990695807_509960975818838,"The Century Beast, our tale of Viking lore and the fiction of H.P. Lovecraft, has only 5 days remaining! We have just broken 1300% funded, so back us now to get in on this remarkable story told in a remarkable way.

https://www.kickstarter.com/projects/jkapalka/the-mysterious-package-company-presents-the-centur",The Mysterious Package Company Presents: The Century Beast,link,https://www.kickstarter.com/projects/jkapalka/the-mysterious-package-company-presents-the-centur,2015-07-02 13:00:42,342,10,42,342,0,0,0,0,0
127857990695807_509906615824274,A member describes what happened when she sent a mysterious package to her boyfriend.,,video,https://www.facebook.com/TheMysteriousPackageCompany/videos/509906615824274/,2015-07-02 10:54:28,117,16,44,117,0,0,0,0,0
127857990695807_509057962575806,"Presented without comment. 

http://qz.com/437793/coloring-is-now-a-normal-adult-activity/",,status,,2015-06-30 07:42:20,48,5,3,48,0,0,0,0,0
127857990695807_508395509308718,A member describes what happened when she sent a mysterious package to her mother.,,video,https://www.facebook.com/TheMysteriousPackageCompany/videos/508395509308718/,2015-06-28 17:12:25,234,25,68,234,0,0,0,0,0
127857990695807_503554393126163,"The Century Beast, inspired by Viking mythology and the works of H.P. Lovecraft, is on the cusp of achieving the $200,000 stretch goal. Investigate this story told by mail today!

https://www.kickstarter.com/projects/jkapalka/the-mysterious-package-company-presents-the-centur",The Mysterious Package Company Presents: The Century Beast,link,https://www.kickstarter.com/projects/jkapalka/the-mysterious-package-company-presents-the-centur,2015-06-19 23:18:35,1041,24,121,1041,0,0,0,0,0
127857990695807_501903679957901,"HLN has a featured interview regarding our Kickstarter. A few secrets were leaked.

http://www.hlntv.com/slideshow/2015/06/17/mysterious-package-company-kickstarter",Kickstart This! The Mysterious Package Company,link,http://www.hlntv.com/slideshow/2015/06/17/mysterious-package-company-kickstarter,2015-06-17 16:09:45,97,6,23,97,0,0,0,0,0
127857990695807_500937460054523,"Two final stretch goals have been added to The Century Beast: an EPILOGUE EDITION of our Curios and Conundrums newspaper, and if we reach the incredible $500,000 funding level, we shall unlock THE KEY. Discover more about this Lovecraft-inspired Viking themed experience now!

https://www.kickstarter.com/projects/jkapalka/the-mysterious-package-company-presents-the-centur?ref=facebook",The Mysterious Package Company Presents: The Century Beast,link,https://www.kickstarter.com/projects/jkapalka/the-mysterious-package-company-presents-the-centur?ref=facebook,2015-06-15 16:23:49,776,19,104,776,0,0,0,0,0
127857990695807_500102366804699,"Amazingly, The Century Beast was funded in less than 9 hours, and in less than 5 days hit the $120,000 stretch goal. Discover more about our newest story, inspired by Viking mythology and the works of H.P. Lovecraft.

http://kck.st/1GEvi7G",The Mysterious Package Company Presents: The Century Beast,link,http://kck.st/1GEvi7G,2015-06-13 13:51:52,59,2,12,59,0,0,0,0,0
127857990695807_499497020198567,"Our Curator was asked some questions, and, in a rare and unexpected turn of events, he answered them.

https://emshort.wordpress.com/2015/06/12/the-century-beast-the-mysterious-package-company/",The Century Beast (The Mysterious Package Company),link,https://emshort.wordpress.com/2015/06/12/the-century-beast-the-mysterious-package-company/#more-8237,2015-06-12 11:39:19,80,2,9,80,0,0,0,0,0
127857990695807_498866220261647,"The response to The Century Beast on Kickstarter has been simply unbelievable. If you have not yet done so, I encourage you to investigate this eerie story of Vikings and eldritch evil.

http://kck.st/1MtonfV",Timeline Photos,photo,https://www.facebook.com/TheMysteriousPackageCompany/photos/a.130539527094320.28215.127857990695807/498866220261647/?type=3,2015-06-11 13:39:55,1096,23,101,1096,0,0,0,0,0
127857990695807_498154030332866,"""I'll tell you, I really enjoyed prying a weird old statue out of a wooden box full of sawdust. It was like my old point-and-click adventure mysteries come to life.""

http://boingboing.net/2015/06/09/treat-yourself-to-a-playful-se.html",Treat yourself to a playful series of mysterious packages,link,http://boingboing.net/2015/06/09/treat-yourself-to-a-playful-se.html,2015-06-09 14:21:24,112,3,16,112,0,0,0,0,0
127857990695807_497951053686497,"Inspired by Viking mythology and the works of H.P. Lovecraft, The Century Beast is our latest wonderful postal experience. We have launched a Kickstarter to help us bring this eldritch adventure to life, and encourage you to investigate today!

https://www.kickstarter.com/projects/jkapalka/the-mysterious-package-company-presents-the-centur",The Mysterious Package Company Presents: The Century Beast,link,https://www.kickstarter.com/projects/jkapalka/the-mysterious-package-company-presents-the-centur,2015-06-09 01:15:00,106,7,20,106,0,0,0,0,0
127857990695807_496970150451254,"My, what an interesting and unusual artifact, sitting on the table beside Cosima. Scott appears to be quite fond of mysterious relics! #OrphanBlack",Timeline Photos,photo,https://www.facebook.com/TheMysteriousPackageCompany/photos/a.130539527094320.28215.127857990695807/496970150451254/?type=3,2015-06-06 21:24:00,103,9,3,103,0,0,0,0,0
127857990695807_496334970514772,"Some experiences may begin with a message in a bottle. A very, very old message, in a very, very old bottle.",A Real Corker: Message in a Bottle May Be World's Oldest,link,http://www.livescience.com/44709-message-in-a-bottle-worlds-oldest.html?cmpid=514627_20150605_43378086&adbid=10152793665151761&adbpl=fb&adbpr=30478646760&utm_content=bufferbf41b&utm_medium=social&utm_source=facebook.com&utm_campaign=buffer,2015-06-05 08:57:54,197,2,19,197,0,0,0,0,0
127857990695807_494795770668692,"Some experiences may begin with discoveries within an ancient and massive underground city, lost for five millennia.","Archeologists discover 5,000-year-old underground city that could",link,http://inhabitat.com/archeologists-dig-up-5000-year-old-underground-city-that-could-be-the-largest-ever-found/?utm_content=buffer7e668&utm_medium=social&utm_source=facebook.com&utm_campaign=buffer,2015-06-01 08:38:09,144,1,33,144,0,0,0,0,0
127857990695807_494186997396236,I have been informed this is to be presented without comment.,Timeline Photos,photo,https://www.facebook.com/TheMysteriousPackageCompany/photos/a.130539527094320.28215.127857990695807/494186997396236/?type=3,2015-05-30 11:54:08,82,2,3,82,0,0,0,0,0
127857990695807_493926537422282,Some experiences begin with an underwater clue to stolen Civil War gold.,Shipwreck discovery may lead to Great Lakes treasure,link,http://www.freep.com/story/news/local/michigan/2015/05/28/shipwreck-great-lakes/28060215/?utm_content=bufferd6868&utm_medium=social&utm_source=facebook.com&utm_campaign=buffer,2015-05-29 15:53:03,39,0,3,39,0,0,0,0,0
127857990695807_493837944097808,Some experiences begin with an... unexpected discovery within a recent excavation of Sudanese pyramids.,Amazing Drone Footage Of Sudan's Mysterious & Forgotten Pyramids,link,http://www.iflscience.com/environment/watch-interesting-drone-footage-el-kurru-pyramids?utm_content=bufferaab70&utm_medium=social&utm_source=facebook.com&utm_campaign=buffer,2015-05-29 08:38:10,62,0,10,62,0,0,0,0,0
127857990695807_493587110789558,"Some experiences begin when the clouds form just so, indicating the time is right.","No, that isn't a UFO. It's a lenticular cloud",link,http://kwqc.com/2015/05/28/no-that-isnt-a-ufo-its-a-lenticular-cloud/?utm_content=buffer12715&utm_medium=social&utm_source=facebook.com&utm_campaign=buffer,2015-05-28 15:53:02,36,2,0,36,0,0,0,0,0
