status_id,status_message,link_name,status_type,status_link,status_published,num_reactions,num_comments,num_shares,num_likes,num_loves,num_wows,num_hahas,num_sads,num_angrys
127857990695807_390122681136002,"My dearest friends,

It has been wonderful to see so many of you commenting on our posts and liking our page during the run up to Hallowe'en. It is a tonic that you enjoy the peculiar nature of what we do, as this is very much a passion for my coterie and I.

I wish to take a moment and remind everyone that our limited edition Mysterious Membership Kits and Inner Circle Kits are available only until the crack of All Hallows. Afterward, they shall be lost to time immemorial, or at least until October hence.

As with all that we do, you must be a member to peruse what we offer. Whilst membership remains free of charge, you must apply upon our website to attain it.

Your servant,

The Curator
at The Mysterious Package Company
https://www.mysteriouspackage.com",The Mysterious Package Company,link,https://www.mysteriouspackage.com/,2014-10-20 18:39:17,246,8,22,246,0,0,0,0,0
127857990695807_388612514620352,"There are five people in this photo, not four. They all were present at the sitting, and the fact the woman on the left does not cast a reflection in the window behind her is merely a trick of the staging of the scene. She was always there, and did not appear on the developed image unexpectedly. Clearly, she is not staring at the man responsible for her untimely death, that would be impossible. This is exactly as it appears to be on the surface, and no mysterious artifacts were to be found this day.

https://www.mysteriouspackage.com",The Mysterious Package Company,link,https://www.mysteriouspackage.com/,2014-10-17 09:11:17,134,20,14,134,0,0,0,0,0
127857990695807_387466954734908,"These three gentlemen are enjoying a spot of snooker, nestled away in the abode of their very exclusive club. The gentlemen with the beard is not about to be quietly dispatched by the unseen man in the shadows to the right. The men standing opposite are not attempting to wrestle control from their compatriot, they are merely standing by for their next shot. A great deal of money has not changed hands, and at the end of the game, everyone shook hands and chortled; any suggestion of a coup is laughable. This is exactly as it appears to be on the surface, and no mysterious artifacts were to be found this day. 

https://www.mysteriouspackage.com",The Mysterious Package Company,link,https://www.mysteriouspackage.com/,2014-10-14 12:45:32,186,10,20,186,0,0,0,0,0
127857990695807_385542251594045,Haunting asylum images. http://buff.ly/1rFl1iy,imgur: the simple image sharer,link,http://imgur.com/a/5rqx6/noscript,2014-10-10 08:38:04,17,0,2,17,0,0,0,0,0
127857990695807_385241311624139,Not everything that is Victorian is necessarily stoic. Even the Curator manages a chuckle occasionally. http://buff.ly/1yQfOcw,Rediscovered Slides Show Victorians Knew How to Get Silly In Front of the Camera,link,http://petapixel.com/2014/10/08/rediscovered-slides-show-victorians-new-how-to-get-silly-in-front-of-the-camera-too/?utm_content=buffer758a8&utm_medium=social&utm_source=facebook.com&utm_campaign=buffer,2014-10-09 15:53:15,25,0,6,25,0,0,0,0,0
127857990695807_381532345328369,"In preparation for the release of our annual Membership Kits, we would like to remind you that membership is required in order to see or participate in the variety of experiences we offer. With October upon us, and Christmas on the horizon, it would behoove you to join now, lest you be disappointed later, as these kits shall only available this month.

Membership is free, but you must apply at https://www.mysteriouspackage.com",The Mysterious Package Company,link,https://www.mysteriouspackage.com/,2014-10-01 12:19:28,360,56,91,360,0,0,0,0,0
127857990695807_377438925737711,"As is our policy, we can neither confirm nor deny this is a part of any of our experiences. http://buff.ly/1usywR0",Mysteries and stuff I discovered... - Barend Buitekamer | Facebook,link,http://www.facebook.com/648804205227251,2014-09-21 15:53:03,7,0,0,7,0,0,0,0,0
127857990695807_376627492485521,"The Curator has a desk quite similar to this one. It makes finding things devilishly difficult when he is not present.

http://themetapicture.com/this-antique-cabinet/",This Is Over 200 Years Old. Watch What It Can Do When They Start Opening Its Drawers,link,http://themetapicture.com/this-antique-cabinet/,2014-09-19 19:58:37,87,7,74,87,0,0,0,0,0
127857990695807_369162756565328,"My dearest friends,

I, and my coterie, have been quite overwhelmed by the lovely things that you are all saying about us. We are terribly flattered that you like us, but I wish to remind you that in order to fully participate in the variety of mysteries that we offer, you must become a member.

Membership is 100% free, but it requires that you apply online. I encourage you to explore our website, and if what you see moves you to action, fill in an application. There is nothing to lose but the mundanity of daily life.

I thank you for your interest and attention, and please do not hesitate to contact me should you have any questions or concerns.

Your servant,

The Curator
at The Mysterious Package Company
https://www.mysteriouspackage.com
",The Mysterious Package Company,link,https://www.mysteriouspackage.com/,2014-09-04 17:21:40,67,14,15,67,0,0,0,0,0
127857990695807_363462340468703,"For those of us who lived through the height of the Cold War in the 1960s through the 1980s, it was a grim and worrisome time. The world was widely divided between countries who were bound by, or protected by, NATO, and those that were grouped by the Warsaw Pact. The spread of communism was seen as a great evil by one side, and the corporate greed and inequality of capitalism as a great evil on the other.

There was, indeed, a Great Evil, but it was neither economic philosophy that held that grandiose title. Inspired by mutual fear and hatred, scientists on both sides of this divide worked diligently to give their superpower the upper hand. While we mere mortals were most obviously in fear of nuclear annihilation, one team developed something so awful, so terrifying, something that could leave a deep psychic scar on the population of the entire earth.

Whether you are feeling that brand of bravery that comes with either intense curiosity or foolish naiveté, we have a story to tell you about a breakthrough, an accident, and a final moment of contrition.

Preorders for Risen are available for only 3 more days, for members only. Membership is free, so apply online at https://www.mysteriouspackage.com?utm_source=fbrisen&utm_medium=social&utm_campaign=page",The Mysterious Package Company,link,https://www.mysteriouspackage.com/?utm_source=aug2014missive2&utm_medium=email&utm_campaign=missive,2014-08-28 14:46:52,267,10,16,267,0,0,0,0,0
127857990695807_360497000765237,"The Curator has approves of this wonderful, remarkable gift: a secret room for a curious son.

http://buff.ly/1tzKE3x",The Secret Treasure Room | Things I Make,link,http://www.goer.org/sarah/2014/08/05/the-secret-treasure-room/?utm_content=buffer1ef52&utm_medium=social&utm_source=facebook.com&utm_campaign=buffer,2014-08-25 08:38:05,28,0,2,28,0,0,0,0,0
127857990695807_352319104916360,"Oxygen-deprived, iron rich saltwater rusts as it enters the world above. This likely story is the truth, and you must not question its veracity.  http://buff.ly/1mKoO81",Antarctica's Blood Red Waterfall,link,http://www.smithsonianmag.com/travel/antarcticas-blood-red-waterfall-180949507/?no-ist&utm_content=bufferde7f7&utm_medium=social&utm_source=facebook.com&utm_campaign=buffer,2014-08-15 15:53:11,46,1,5,46,0,0,0,0,0
127857990695807_352086731606264,We draw our inspiration from myriad truths that are often stranger than the weirdest of fiction. http://buff.ly/1oqxrKu,Derinkuyu & The Underground Cities of Cappadocia,link,http://sometimes-interesting.com/2014/05/09/derinkuyu-the-underground-cities-of-cappadocia/?utm_content=buffer094db&utm_medium=social&utm_source=facebook.com&utm_campaign=buffer,2014-08-15 08:38:20,31,2,9,31,0,0,0,0,0
127857990695807_351622531652684,"We can neither confirm nor deny our involvement in the placement of any mysterious artifacts. We can, however, confirm that we have been in business a very, very long time.

http://buff.ly/Y93i7m",'Evil' Artifact Discovered In Ancient Cemetery,link,http://www.huffingtonpost.com/2014/08/13/ancient-evil-eye-box-discovered-cemetery_n_5675026.html?utm_content=bufferdd402&utm_medium=social&utm_source=facebook.com&utm_campaign=buffer,2014-08-14 15:53:24,53,0,3,53,0,0,0,0,0
127857990695807_347807548700849,"This is quite fascinating, but as always, we can neither confirm nor deny our involvement in any mysterious packages. http://buff.ly/1ny7J0s",Abandoned Suitcase,link,http://chawedrosin.wordpress.com/2014/07/09/abandoned-suitcase/?utm_content=bufferbc133&utm_medium=social&utm_source=facebook.com&utm_campaign=buffer,2014-08-08 08:38:01,61,5,6,61,0,0,0,0,0
127857990695807_347614612053476,"If, like us, you are a fan of creative and difficult puzzles, this will provide you with something to mull. ""[T]he biggest mistake players make in trying to crack his challenge is over-thinking and over-engineering solutions."" http://buff.ly/V4Ptov",Meet the Puzzle Mastermind Who Designs Def Con's Hackable Badges | Threat Level | WIRED,link,https://www.wired.com/2014/08/defcon-2014-badges-revealed/?utm_content=buffer7df50&utm_medium=social&utm_source=facebook.com&utm_campaign=buffer,2014-08-07 15:53:11,14,0,2,14,0,0,0,0,0
127857990695807_345954005552870,"This would make quite a lovely artifact. I must remember to show this to the Artisan.

http://buff.ly/1m7RTKl",#1050; In which a Phone is made Familiar,link,http://wondermark.com/1k50/?utm_content=buffer7dfdc&utm_medium=social&utm_source=facebook.com&utm_campaign=buffer,2014-08-02 15:53:13,14,1,0,14,0,0,0,0,0
127857990695807_345851878896416,"Did you hear something? No? It's probably nothing, and we are unlikely to be involved.","A mysterious sound is driving people insane, it's spreading — and nobody knows what's causing it",link,http://theextinctionprotocol.wordpress.com/2014/07/06/a-mysterious-sound-is-driving-people-insane-its-spreading-and-nobody-knows-whats-causing-it/?utm_content=buffer894ac&utm_medium=social&utm_source=facebook.com&utm_campaign=buffer,2014-08-02 08:38:07,20,0,6,20,0,0,0,0,0
127857990695807_345638298917774,The Professor is planning his next vacation here to investigate more closely.,Mysterious 'Rings' Even Stranger Than Scientists Thought,link,http://www.huffingtonpost.com/2014/07/08/rainforest-rings-amazon_n_5567031.html?utm_content=buffer2f146&utm_medium=social&utm_source=facebook.com&utm_campaign=buffer,2014-08-01 15:53:02,13,0,3,13,0,0,0,0,0
127857990695807_345521495596121,"Author Todd Babiak writes about some mysterious items he received in the post.

http://buff.ly/1oa6itH",A Mysterious Package arrives,link,http://toddbabiak.com/2014/07/a-mysterious-package-arrives/?utm_content=buffere18dd&utm_medium=social&utm_source=facebook.com&utm_campaign=buffer#.U9qs21Zv31o,2014-08-01 08:38:03,16,0,1,16,0,0,0,0,0
127857990695807_344347299046874,"Even the smartest among us sometimes make mistakes. NASA crashed a probe on Mars because they forgot to convert from imperial to metric. These simple errors are an aspect of being human, and why would we presume to think those who will develop time travel are immune to their very nature?

If someone goes back in time, how do they get a message to the future, to their colleagues, or to their loved ones? We at The Mysterious Package Company know a thing or two about sending messages across time and space, and there are clever ways to overcome the temporal limitations of communication.

Preorders for our latest Curated Experience end July 31st, and details are available exclusively to members. Membership is free, so apply now at http://www.mysteriouspackage.com",Timeline Photos,photo,https://www.facebook.com/TheMysteriousPackageCompany/photos/a.130539527094320.28215.127857990695807/344345109047093/?type=3,2014-07-29 00:46:18,104,5,13,104,0,0,0,0,0
127857990695807_341880052626932,"There is a great tactile joy to opening one of our crates. Creak... tap, tap... rustle. http://buff.ly/1qpF7tB",Opening a #mysteriouspackage. Shot by Leigh Young,video,https://vine.co/v/MPTI39wXAn1?utm_content=bufferf61f8&utm_medium=social&utm_source=facebook.com&utm_campaign=buffer,2014-07-21 09:40:09,43,0,0,43,0,0,0,0,0
127857990695807_339385446209726,"Among the items our still-missing intern discovered in the archives was this brief safety film. We believe it will be of daily benefit to you, and to those you love.

https://vimeo.com/94885403",In the event of... A Mysterious Package,video,https://vimeo.com/94885403?utm_content=buffercd0d6&utm_medium=social&utm_source=facebook.com&utm_campaign=buffer,2014-07-14 09:15:11,62,0,5,62,0,0,0,0,0
127857990695807_337166543098283,"We are all quite pleased to announce that we have relaunched our website, and encourage you to investigate. The items recovered by our intern are on the homepage, including an old safety film that you may find enjoyable.

https://www.mysteriouspackage.com
",Curious Experiences by Mail | The Mysterious Package Company,link,https://www.mysteriouspackage.com/,2014-07-07 13:45:48,126,6,21,126,0,0,0,0,0
127857990695807_331841133630824,Some suspiciously business-casual attire was worn by Scott during tonight's season finale of #OrphanBlack: our limited edition t-shirt!,Photos from The Mysterious Package Company's post,photo,https://www.facebook.com/TheMysteriousPackageCompany/photos/a.130539527094320.28215.127857990695807/331839110297693/?type=3,2014-06-22 00:23:54,56,0,3,56,0,0,0,0,0
127857990695807_331805210301083,,The Mysterious Package Company's cover photo,photo,https://www.facebook.com/TheMysteriousPackageCompany/photos/a.129886537159619.28008.127857990695807/331805116967759/?type=3,2014-06-21 21:51:11,53,2,6,53,0,0,0,0,0
127857990695807_327951870686417,"As always, the Curator has dictated that we may neither confirm nor deny our involvement in this really quite lovely marriage proposal.

http://www.thestar.com/entertainment/2014/06/10/surprise_marriage_proposal_scooped_by_welland_tribune_reporter.html",Surprise marriage proposal scooped by Welland Tribune reporter | Toronto Star,link,http://www.thestar.com/entertainment/2014/06/10/surprise_marriage_proposal_scooped_by_welland_tribune_reporter.html,2014-06-10 12:21:02,15,1,1,15,0,0,0,0,0
127857990695807_317496071731997,"A discovery was made whilst an intern was rummaging about in the MPC Archives. We are currently restoring it for a public release.

The intern suffered no long-term ill effects, and is expected to make a full recovery.",,status,,2014-05-11 20:02:46,26,0,0,26,0,0,0,0,0
127857990695807_312753112206293,"Our own experiences with time travel are 100% murder-free.

http://www.bbc.com/news/science-environment-26324244",The strange case of the 'time travel' murder,link,http://www.bbc.com/news/science-environment-26324244,2014-04-28 16:09:59,21,0,3,21,0,0,0,0,0
127857990695807_304696623011942,"The end of each adventure is sealed with wax.

http://www.mysteriouspackage.com",Timeline Photos,photo,https://www.facebook.com/TheMysteriousPackageCompany/photos/a.130539527094320.28215.127857990695807/304696356345302/?type=3,2014-04-03 21:40:00,49,1,2,49,0,0,0,0,0
127857990695807_303717316443206,"The Curator has an exciting and mysterious announcement that shall be made at midnight EDT. If you have not yet applied as a member of The Mysterious Package Company, we would strongly suggest that you do so now.

Note that the Curator is not one for the pranks so common on April 1st, and you may rest assured that there will be no leg pulling, deceptions, or shenanigans.

http://www.mysteriouspackage.com/apply",Timeline Photos,photo,https://www.facebook.com/TheMysteriousPackageCompany/photos/a.130539527094320.28215.127857990695807/303717123109892/?type=3,2014-03-31 16:40:25,18,2,1,18,0,0,0,0,0
127857990695807_10153939707390591,"The Curator has dictated that we may neither confirm nor deny our involvement in any experiences that may or may not be in process. 

http://www.thestar.com/news/gta/2014/03/23/baffling_coded_messages_discovered_at_western_university.html",Baffling coded messages discovered at Western University | Toronto Star,link,http://www.thestar.com/news/gta/2014/03/23/baffling_coded_messages_discovered_at_western_university.html,2014-03-24 11:58:28,12,0,3,12,0,0,0,0,0
127857990695807_10153904130340591,"The Curator deeply approves of this trend.

http://www.nytimes.com/2014/03/06/fashion/the-monocle-returns-as-a-fashion-accessory.html?_r=0",The Monocle Returns as a Fashion Accessory,link,http://www.nytimes.com/2014/03/06/fashion/the-monocle-returns-as-a-fashion-accessory.html?_r=0,2014-03-14 13:53:42,22,0,1,22,0,0,0,0,0
127857990695807_10153843669150591,"We are able to neither confirm nor deny whether your existence is a simulation, regardless of the mathematical implications.

http://www.nytimes.com/2014/02/16/opinion/sunday/is-the-universe-a-simulation.html?_r=3",Is the Universe a Simulation?,link,http://www.nytimes.com/2014/02/16/opinion/sunday/is-the-universe-a-simulation.html?_r=3,2014-02-25 11:56:35,8,0,0,8,0,0,0,0,0
127857990695807_292474890900782,"We were recently provided with this photographic evidence of one of our members diligently working on solving the mysteries of Curios and Conundrums, whilst comfortably wrapped in our limited-edition t-shirt. Our official position is that we can neither conform nor deny wearing our apparel will assist in this endeavour.

Find out more at http://www.mysteriouspackage.com",Timeline Photos,photo,https://www.facebook.com/TheMysteriousPackageCompany/photos/a.130539527094320.28215.127857990695807/292473944234210/?type=3,2014-02-24 22:48:06,23,0,0,23,0,0,0,0,0
127857990695807_10153839686165591,"At the behest of the Curator, we can neither confirm nor deny that the Norwegian branch offices of The Mysterious Package Company are located beneath Svalbard.

http://www.viralnova.com/svalbard-seed-vault/",I Had No Idea This Vault Hidden Deep In The Mountains Even Existed. Let Alone What's Inside.,link,http://www.viralnova.com/svalbard-seed-vault/,2014-02-24 09:34:56,17,0,4,17,0,0,0,0,0
127857990695807_290731391075132,,Timeline Photos,photo,https://www.facebook.com/TheMysteriousPackageCompany/photos/a.130539527094320.28215.127857990695807/290731347741803/?type=3,2014-02-19 16:02:31,6,0,1,6,0,0,0,0,0
127857990695807_290027677812170,,Timeline Photos,photo,https://www.facebook.com/TheMysteriousPackageCompany/photos/a.130539527094320.28215.127857990695807/290027657812172/?type=3,2014-02-17 13:56:28,8,0,1,8,0,0,0,0,0
127857990695807_289006717914266,,Timeline Photos,photo,https://www.facebook.com/TheMysteriousPackageCompany/photos/a.130539527094320.28215.127857990695807/289006614580943/?type=3,2014-02-14 12:03:05,17,0,0,17,0,0,0,0,0
127857990695807_10153727332665591,"The Curator insists that we assure our membership that the quality of our packages are significantly higher than those contained within this video.

http://www.theonion.com/video/suspicious-package-industry-falls-on-hard-times,14225/",Suspicious Package Industry Falls On Hard Times,link,"http://www.theonion.com/video/suspicious-package-industry-falls-on-hard-times,14225/",2014-01-22 14:33:21,15,0,0,15,0,0,0,0,0
127857990695807_268404156641189,"My dearest friends,

I was informed by my coterie that our Facebook page has exceeded 1000 likes. This is a remarkable milestone for our fledgling company, and I would like to extend a heartfelt welcome to all of you who have decided that we are worthy of your attention and time.

Additionally, I would like to remind you that in order to truly understand what we do, you must apply for membership upon our website. Membership is 100% free, and includes access not only to our offerings, but to a community of like-minded mystery lovers.

2014 is shaping up to be an astonishing year, and I encourage you to join us on this journey, as we have myriad surprises yet to come. So, allow us to narrate a story for you or a loved one. 

http://www.mysteriouspackage.com/

Your servant,

The Curator
at The Mysterious Package Company",Curious Experiences by Mail | The Mysterious Package Company,link,http://www.mysteriouspackage.com/,2013-12-18 16:49:08,64,10,4,64,0,0,0,0,0
127857990695807_267848603363411,"The Curator has requested this be presented to you here, without further comment.

http://www.mysteriouspackage.com/",Timeline Photos,photo,https://www.facebook.com/TheMysteriousPackageCompany/photos/a.130539527094320.28215.127857990695807/267848596696745/?type=3,2013-12-16 20:01:28,24,5,1,24,0,0,0,0,0
127857990695807_266150010199937,"Our limited edition Membership Kits are starting to arrive for those lucky members who purchased them, and the Curator has requested some mysterious photographs of your fancy new attire, and anything you might mark with stickers. He has authorized us to post the best ones both here and in our Library. Forward him your photographs by email to: curator@mysteriouspackage.com

Not yet a member? Allow us to narrate a story for you or a loved one. No two are alike! Find out more at http://www.mysteriouspackage.com",,status,,2013-12-11 17:25:06,9,1,1,9,0,0,0,0,0
127857990695807_265373603610911,"The Curator has requested this be presented to you here, without further comment.

http://www.mysteriouspackage.com",Timeline Photos,photo,https://www.facebook.com/TheMysteriousPackageCompany/photos/a.130539527094320.28215.127857990695807/265373593610912/?type=3,2013-12-09 23:10:14,22,1,1,22,0,0,0,0,0
127857990695807_264973430317595,"What deviousness might the wearer of this shirt be privy to? An unsuspecting gentleman, once merrily going about his own business, has been marked.

http://www.mysteriouspackage.com",Timeline Photos,photo,https://www.facebook.com/TheMysteriousPackageCompany/photos/a.130539527094320.28215.127857990695807/264973416984263/?type=3,2013-12-08 15:36:59,15,0,2,15,0,0,0,0,0
127857990695807_264293843718887,"What mysteries might lie within the pages of this notebook? It was so innocent, once, but now it has been marked.

http://www.mysteriouspackage.com",Timeline Photos,photo,https://www.facebook.com/TheMysteriousPackageCompany/photos/a.130539527094320.28215.127857990695807/264293830385555/?type=3,2013-12-06 11:38:30,14,2,1,14,0,0,0,0,0
127857990695807_260297087451896,"The Professor to the Curator reviews the puzzles and assorted secrets of our quarterly. Not pictured: a maniacal grin. There have been vague and equivocal reports of chortling, and one unconfirmed source said that the Professor whooped. This reporter considers that highly unlikely.

Curios and Conundrums is available exclusively to our membership. Find out more and apply for free at http://www.mysteriouspackage.com",Timeline Photos,photo,https://www.facebook.com/TheMysteriousPackageCompany/photos/a.130539527094320.28215.127857990695807/260289550785983/?type=3,2013-11-24 03:02:18,19,0,3,19,0,0,0,0,0
127857990695807_259830040831934,"Subscribers to Curios and Conundrums should start receiving the Prologue today, and over the next several days. If you subscribed after November 1st, we've included a copy of our newspaper for you to enjoy, but not the entire prologue.

Not a member? Membership is free, so apply now at http://www.mysteriouspackage.com",Timeline Photos,photo,https://www.facebook.com/TheMysteriousPackageCompany/photos/a.130539527094320.28215.127857990695807/259830024165269/?type=3,2013-11-22 15:13:10,13,2,2,13,0,0,0,0,0
127857990695807_259221887559416,"My dearest friends,

I am truly overwhelmed by the tremendous number of new followers who have joined us in this past fortnight. However, it is important that you are all aware that you must solicit membership in order to peruse the offerings of The Mysterious Package Company, and to truly participate in our community. Membership is 100% free, and merely acts as a barrier between you and anyone you intend on sending mystery to.

http://www.mysteriouspackage.com/apply

We have myriad mysteries available, so please take a moment to fill in our brief application form.

I am looking forward to welcoming you as members of our community.

Your servant,

The Curator
at The Mysterious Package Company",Apply for Membership | The Mysterious Package Company,link,https://www.mysteriouspackage.com/apply,2013-11-20 14:48:16,14,0,3,14,0,0,0,0,0
127857990695807_258555074292764,"We have just made some dramatic improvements to our Library. You should login now and find out more about what we do. 

Not a member? Join for free at http://www.mysteriouspackage.com",Curious Experiences by Mail | The Mysterious Package Company,link,http://www.mysteriouspackage.com/,2013-11-18 10:41:42,20,0,2,20,0,0,0,0,0
127857990695807_257582144390057,"A suspicious delivery arrived this morning at one of our safehouses. Here, we are providing photographic evidence of this happening in the hopes that others will come forward, unafraid of the potential consequences.

http://www.mysteriouspackage.com",Timeline Photos,photo,https://www.facebook.com/TheMysteriousPackageCompany/photos/a.130539527094320.28215.127857990695807/257582114390060/?type=3,2013-11-15 11:39:53,20,3,2,20,0,0,0,0,0
127857990695807_256474667834138,"The Artisan peruses a quarterly tabloid newspaper, seeking evasive answers.",Timeline Photos,photo,https://www.facebook.com/TheMysteriousPackageCompany/photos/a.130539527094320.28215.127857990695807/256474644500807/?type=3,2013-11-12 00:54:37,31,1,2,31,0,0,0,0,0
