status_id,status_message,link_name,status_type,status_link,status_published,num_reactions,num_comments,num_shares,num_likes,num_loves,num_wows,num_hahas,num_sads,num_angrys
127857990695807_994218007393130,"Is this thing on... hel... hello?? Hi. This is weird... I'm more used to reacting to your comments, so it's different and confusing to be the first one to... 

Hi. It's me, the Messenger. I've been relentlessly ""not answering"" your questions on Facebook for years now. Some of you have confused me for the Curator, which is flattering, but we are very different. For example, if I were the Curator, I'd be writing on parchment right now and asking again why we have to write anything it's just a book full of faces.

Let's get this out of the way quickly: No, we aren't going out of business. No, we haven't been sold to a shady investor who is liquidating the company. Yes, that's exactly what a company doing both those things would say, right? After all, we have been running frequent sales and archiving some of our older Experiences. 

While we won't reveal all our secrets—that has not changed, nor will it ever– we do want to let our biggest supporters know what's happening... which has changed, I'll admit. I'm not used to this ""dispensing real information"" thing. But here goes nothing!

The truth — about the big sales and archiving — is somewhat more mundane. Some of our existing experiences are showing their age, and you, our members, have repeatedly told us that you want more active, involved Experiences. We began 2016 with three Experiences available in our store and were one short of four times that many by the end of 2017. Keeping all the old Experiences is a lot of work and makes it harder to start up new projects.

Hence, we are clearing out our old inventory to make way for the new.

... I have just heard the sound of thousands of ears perking up. For the curious, the sound is off-putting and quite nauseating, though lovely at the same time, like a choir of angelic children struggling to hit a five-part harmony at a school pageant.

Yes, you have heard correctly.  New items are coming later this spring, and they are unlike anything we have ever done before! It has been an adventure keeping our cards so close to our collective chests, all the while staying in the zone to uphold the mystery, but it will be worth it. Perhaps you saw the breadcrumbs we left for one?

In any case, that's all I have for today. Honestly... I'd like to get back to being helpfully unhelpful, now!

~ The Messenger",,photo,https://www.facebook.com/TheMysteriousPackageCompany/photos/a.130539527094320.28215.127857990695807/994214034060194/?type=3,2018-03-22 15:23:22,189,20,5,150,32,1,6,0,0
127857990695807_993005297514401,"Friends of the Curator have launched a Kickstarter campaign, but take note:  only the most clever are required to play Forbidden Games",Railroad Rivals,link,https://www.kickstarter.com/projects/954412004/railroad-rivals/,2018-03-20 12:48:14,29,3,10,24,0,1,0,4,0
127857990695807_992560100892254,"Thanks to you, our beloved members, we are fast approaching the completion of our most perilous obligation: the promise to find secure repositories for the ancient Demon Jars, most recently held by the Daughters of Naamah.

Accordingly, we are discounting the jars by $100",The Demon Jar,link,https://mysteriouspackage.com/products/dja?utm_campaign=facebook_post_2018-03-19T22%3A24%3A27Z&utm_content=facebook_page&utm_medium=admin&utm_source=facebook,2018-03-19 17:24:27,30,6,6,25,4,0,1,0,0
127857990695807_976954855786112,"For a limited time, we've included our newest and most expensive Experiences to our Surprise Me offering. Value up to $350 USD!",The Mysterious Package Company,link,https://mysteriouspackage.com/products/surprise-me?utm_campaign=facebook_post_2018-02-20T15%3A13%3A46Z&utm_content=facebook_page&utm_medium=admin&utm_source=facebook,2018-02-20 10:13:46,6,6,0,6,0,0,0,0,0
127857990695807_974192542729010,"""""Aha!"" said Percival. ""I've watched this pot for the last twenty minutes, and even while observed, it boiled!"" 

If mother was wrong about this, he reasoned to himself, perhaps someone could love him one day.""

Get Crushed. The 15th is your last chance to take advantage of our sale.

https://www.mysteriouspackage.com",Timeline Photos,photo,https://www.facebook.com/TheMysteriousPackageCompany/photos/a.130539527094320.28215.127857990695807/974192542729010/?type=3,2018-02-15 16:45:00,12,1,0,9,3,0,0,0,0
127857990695807_974080699406861,Last day to get 14% off your order,The Mysterious Package Company,link,https://mysteriouspackage.com/discount/CRUSHTHEM14?utm_campaign=facebook_post_2018-02-15T17%3A21%3A01Z&utm_content=facebook_page&utm_medium=admin&utm_source=facebook,2018-02-15 12:21:01,5,1,0,4,1,0,0,0,0
127857990695807_973933229421608,"""Classy Hat and a Trimmed Moustache, then take a knee by the old oak tree!"" Now his thirtieth year waiting for love on Valentines day, Claymore was starting to question his mother's relationship advice.""

Get Crushed. Our sale ends on the 15th.

https://www.mysteriouspackage.com",Timeline Photos,photo,https://www.facebook.com/TheMysteriousPackageCompany/photos/a.130539527094320.28215.127857990695807/973933229421608/?type=3,2018-02-15 07:48:00,3,0,0,3,0,0,0,0,0
127857990695807_973629339451997,"""A stern Valentines to you. Now, get back to your place of employment. Love has been dead since INDUSTRY WAS BORN! Sincerely, Henry Clay.""

Get Crushed. The 15th is your last chance to take advantage of our sale.

https://www.mysteriouspackage.com",Timeline Photos,photo,https://www.facebook.com/TheMysteriousPackageCompany/photos/a.130539527094320.28215.127857990695807/973629339451997/?type=3,2018-02-14 17:36:01,8,1,0,7,0,0,1,0,0
127857990695807_973612549453676,"""The bachelor's night out had been going well, but when Wilfred invited them to the living room they saw that, despite being three bachelors, he had only one rose left. Tonight was the night.""

Get Crushed. The 15th is your last chance to take advantage of our sale.

https://www.mysteriouspackage.com",Timeline Photos,photo,https://www.facebook.com/TheMysteriousPackageCompany/photos/a.130539527094320.28215.127857990695807/973612549453676/?type=3,2018-02-14 16:45:01,2,0,0,0,0,0,2,0,0
127857990695807_972409169574014,Soon to be archived! Get Crushed Sale: save $80 + take an additional 14% Quest of the Werejaguar while quantities last. Use promo code CRUSHTHEM14 at checkout.,Quest of the Werejaguar,link,https://mysteriouspackage.com/products/qwj?utm_campaign=facebook_post_2018-02-12T20%3A49%3A26Z&utm_content=facebook_page&utm_medium=admin&utm_source=facebook,2018-02-12 15:49:26,2,2,0,2,0,0,0,0,0
127857990695807_971357643012500,"""Harold felt the date might have gone off the rails around the time they started throwing live dynamite into the swimming hole.""

Get Crushed... Valentine's Day, our way! The sale lasts until Valentine's Day.

https://www.mysteriouspackage.com",Timeline Photos,photo,https://www.facebook.com/TheMysteriousPackageCompany/photos/a.130539527094320.28215.127857990695807/971357643012500/?type=3,2018-02-10 16:45:09,12,4,2,10,0,0,2,0,0
127857990695807_971121023036162,"""Harold felt the date might have gone off the rails around the time they started throwing live dynamite into the swimming hole.""

Get Crushed! Our sale lasts until Valentine's Day.

https://www.mysteriouspackage.com",Timeline Photos,photo,https://www.facebook.com/TheMysteriousPackageCompany/photos/a.130539527094320.28215.127857990695807/971121023036162/?type=3,2018-02-10 07:48:01,13,0,2,8,0,0,5,0,0
127857990695807_970836266397971,"""I want to bear our beautiful children!"" echoed across the deck. Instantly, Julia regretted the suggestion that they count down from three before shouting out their biggest secret. 

""I'm your brother,"" Malcolm repeated, just to be sure that she heard him. 

Get Crushed. Our sale lasts until Valentine's Day.

https://www.mysteriouspackage.com",Timeline Photos,photo,https://www.facebook.com/TheMysteriousPackageCompany/photos/a.130539527094320.28215.127857990695807/970836266397971/?type=3,2018-02-09 18:38:49,13,7,6,11,1,0,1,0,0
127857990695807_970784229736508,"In a rare public acknowledgement, our Experience Q*u*e*s*t of the W*e*r*e*j*a*g*u*a*r is reaching the end of its current lot, and is scheduled to be archived. We will still honour the $80 discount from our Get Crushed sale despite its increasing scarcity, so act quickly! Quantities are limited and we do not know how long they will last!

https://www.mysteriouspackage.com/products/qwj",Quest of the Werejaguar,link,https://www.mysteriouspackage.com/products/qwj,2018-02-09 15:44:20,12,3,0,10,1,0,0,1,0
127857990695807_969967683151496,"""Gerald was now realizing just how much of a hot-head Pierre could be, and conceded that, it's true, he had chosen the restaurant and, yes, it would only be fair that Pierre choose the movie. ""After you,"" he said, the tension subsiding."" 

""Get Crushed!"" Our Valentine's Sale for all lovers, hot-headed or not.

https://www.mysteriouspackage.com",Timeline Photos,photo,https://www.facebook.com/TheMysteriousPackageCompany/photos/a.130539527094320.28215.127857990695807/969967683151496/?type=3,2018-02-08 07:48:04,13,2,0,10,1,0,2,0,0
127857990695807_969700686511529,"""Do you want to know the best place to find love? Look for Jon Longjohn! He can tell you where to go, though… .don't ask Jon Longjohn for love… Jon cannot be loved."" 

Valentine's Day the Mysterious Package Company Way.

Our ""Get Crushed"" sale is now on. 

https://www.mysteriouspackage.com",Timeline Photos,photo,https://www.facebook.com/TheMysteriousPackageCompany/photos/a.130539527094320.28215.127857990695807/969700686511529/?type=3,2018-02-07 16:45:05,12,1,0,11,1,0,0,0,0
127857990695807_969455773202687,"""Herman wanted to surprise Mildred by popping the question in their favourite garden. But it was Herman who was surprised when Mildred insisted on a prenup and produced the legal documents… already dated and signed by a notary public.""

Get Crushed: Valentine's Day the Mysterious Package Company way.

See what's on sale now at https://www.mysteriouspackage.com",Timeline Photos,photo,https://www.facebook.com/TheMysteriousPackageCompany/photos/a.130539527094320.28215.127857990695807/969455773202687/?type=3,2018-02-07 07:48:00,18,3,1,12,0,0,6,0,0
127857990695807_968978653250399,"""They say opposites attract! But when Barbara fell for Greigore the Lute player, she expected a lot more lute playing, and a lot less pigeon talk."" Valentine's Day the Mysterious Package Company way: Get Crushed! 

https://www.mysteriouspackage.com",Timeline Photos,photo,https://www.facebook.com/TheMysteriousPackageCompany/photos/a.130539527094320.28215.127857990695807/968978653250399/?type=3,2018-02-06 07:48:00,20,3,3,18,2,0,0,0,0
127857990695807_968682226613375,"""I only have eye for you!"" the Cyclops says. What he doesn't know is that Juniper is faking, and she is about to unleash her furious roundhouse kick, known locally among prize fighters as ""The Poundhouse."" 

Valentine's Day, the Mysterious Package Company way. Our ""Get Crushed"" sale is on now.

https://www.mysteriouspackage.com",Timeline Photos,photo,https://www.facebook.com/TheMysteriousPackageCompany/photos/a.130539527094320.28215.127857990695807/968682226613375/?type=3,2018-02-05 17:45:00,24,1,3,20,3,0,1,0,0
127857990695807_968624369952494,"""If Beatrice can pick the hand with the wedding ring Bernard will marry her. Unfortunately, Bernard is a master of leger-de-main. 42 years. 42  guesses. 42 perfectly executed French Drops.""

Valentines Day, the Mysterious Package Company way. The ""Get Crushed"" sale is on now.

https://www.mysteriouspackage.com",Timeline Photos,photo,https://www.facebook.com/TheMysteriousPackageCompany/photos/a.130539527094320.28215.127857990695807/968624369952494/?type=3,2018-02-05 15:09:11,21,2,2,19,2,0,0,0,0
127857990695807_966469900167941,"""But he that dares not grasp the thorn should never crave the rose."" — Anne Bronte

https://mysteriouspackage.com/collections/experiences",Timeline Photos,photo,https://www.facebook.com/TheMysteriousPackageCompany/photos/a.130539527094320.28215.127857990695807/966469900167941/?type=3,2018-02-01 20:00:51,28,2,4,25,3,0,0,0,0
127857990695807_966454243502840,Presented without comment.,Timeline Photos,photo,https://www.facebook.com/TheMysteriousPackageCompany/photos/a.130539527094320.28215.127857990695807/966454243502840/?type=3,2018-02-01 19:00:11,25,2,0,24,0,0,1,0,0
127857990695807_966434230171508,"""If you enjoy the fragrance of a rose, you must accept the thorns which it bears."" — Isaac Hayes.",Timeline Photos,photo,https://www.facebook.com/TheMysteriousPackageCompany/photos/a.130539527094320.28215.127857990695807/966434230171508/?type=3,2018-02-01 18:00:04,31,7,7,28,3,0,0,0,0
127857990695807_966413240173607,"Presented without comment.

https://mysteriouspackage.com/collections/experiences",Timeline Photos,photo,https://www.facebook.com/TheMysteriousPackageCompany/photos/a.130539527094320.28215.127857990695807/966413240173607/?type=3,2018-02-01 17:00:18,5,0,0,5,0,0,0,0,0
127857990695807_966361236845474,"Presented without comment.

https://mysteriouspackage.com/collections/experiences",Timeline Photos,photo,https://www.facebook.com/TheMysteriousPackageCompany/photos/a.130539527094320.28215.127857990695807/966361236845474/?type=3,2018-02-01 15:00:58,14,0,1,13,1,0,0,0,0
127857990695807_961321110682820,"I would be remiss if I did not mention that everything we have in our store is currently discounted. I've been told it's the largest sale we've ever had, with some Experiences reduced in price by as much as 50%. I've heard nothing about a name for this promotion... or a reason or anything really... so, I suppose it's no big deal? Just another sale! That is the last thing I will say on the subject for now. Enjoy this photograph of an invisible man buried in leaves that I made.",Timeline Photos,photo,https://www.facebook.com/TheMysteriousPackageCompany/photos/a.130539527094320.28215.127857990695807/961321110682820/?type=3,2018-01-23 11:01:43,87,18,8,71,9,1,5,1,0
127857990695807_946091912205740,"Members can now access all of our free 2017 Dread Holiday traditions, including three printable ornaments, a delicious drink, a ghastly recipe, a tale and a carol. For members only. If you aren't a member, apply today.
 
https://www.mysteriouspackage.com/dread-holidays",,photo,https://www.facebook.com/TheMysteriousPackageCompany/photos/a.130539527094320.28215.127857990695807/946090388872559/?type=3,2017-12-25 19:34:25,92,11,16,79,13,0,0,0,0
127857990695807_943895205758744,"Do you have a friend who could use some extra responsibility? Can you trust them to put goodness and all of humanity ahead of evil and the promise of absolute power, everlasting life and anything else that they desire in exchange for the release of an all-powerful being from their glassy prison? 

If you answered ""Yes"" to both of these questions, you are in luck! Demon Jar is on sale!",The Mysterious Package Company,link,https://www.mysteriouspackage.com/?utm_content=buffer70d28&utm_medium=social&utm_source=facebook.com&utm_campaign=buffer,2017-12-21 16:45:11,83,8,14,75,7,1,0,0,0
127857990695807_939469896201275,"As we approach the end of the Dread Holiday season, we share the time-honoured traditions we have celebrated year after year. 

Precisely ""year after year."" 

It is our second year celebrating them. So we are offering you a goat, among other things!",The Dread Holidays Traditions,link,https://www.mysteriouspackage.com/dread-holidays?utm_content=buffer4f7f2&utm_medium=social&utm_source=facebook.com&utm_campaign=buffer,2017-12-13 07:48:03,32,9,7,28,1,0,3,0,0
127857990695807_938198319661766,"Despite only being two years old the Dread Holidays have already a rich tapestry of traditions, and we are excited to share some of our Dread Holiday traditions with members. The first two are:

• A Dread Holidays tale, the sweet story about a girl and her cat.†
• An official ornament you can print celebrate one our most beloved antiheroes of the season.º

There are more to come through the Dread Holiday season. You can choose to return to the page at your leisure, or wait for our notices when something new is available!

https://www.mysteriouspackage.com/dread-holidays

† Read through to the conclusion before reading this story allowed to your children

º Please remember: our ornaments are not meant to be hung on a tree (though to each their own, I suppose it could work!). Traditionally, we hang them in the darkest corner of our house, above a bowl of autumn leaves... you... saved some autumn leaves in a bowl, didn't you? If not, paper cutouts of leaves, or a reasonable facsimile, will not disrupt the holiday season!",Login | The Mysterious Package Company,link,https://www.mysteriouspackage.com/dread-holidays,2017-12-10 19:12:11,42,5,4,40,2,0,0,0,0
127857990695807_936838463131085,We neither confirm nor deny that our Gift Guide offers non-members an unprecedented insight into the offerings of Mysterious Package Company...,The Official Dread Holidays Gift Guide,link,https://www.mysteriouspackage.com/gift-guide-public?utm_content=buffer1471f&utm_medium=social&utm_source=facebook.com&utm_campaign=buffer,2017-12-08 07:48:00,75,10,9,69,6,0,0,0,0
127857990695807_936545799827018,"It is our second year celebrating The Dread Holidays and would be most honoured if you were to join us. We will soon be sharing some of our traditional symbols, tales and songs, both here and through our weekly missives sent to members.  The Dread Holidays is also a time of giving, so members can enjoy deep discounts on many of our goods!

So monitor your inboxes closely for our Dread Holiday surprises. And if you are not yet a member, remember: there is a 100% likelihood that those who do not apply will not be accepted. Apply now!",Spread the Dread!,link,https://www.mysteriouspackage.com/?utm_content=buffer0c7a2&utm_medium=social&utm_source=facebook.com&utm_campaign=buffer,2017-12-07 16:45:01,35,7,5,32,2,1,0,0,0
127857990695807_936052036543061,"In the rainforest of Guatemala, there is an entire civilization lost to history, and forgotten by all but one... that is, until an unexpected letter arrives in your mailbox. For members only, and for a very limited time, the Quest is $15 off the regular price. Are you ready for an adventure?",Timeline Photos,photo,https://www.facebook.com/TheMysteriousPackageCompany/photos/a.130539527094320.28215.127857990695807/936052036543061/?type=3,2017-12-06 16:45:13,36,3,5,32,3,1,0,0,0
127857990695807_934620906686174,"Since they're stories you can touch, 
you'll need no manual to use 'em.
Though we recognize we're strange, 
so here's a guide to help you choose 'em.

https://www.mysteriouspackage.com/gift-guide-public",The Mysterious Package Company,link,https://www.mysteriouspackage.com/gift-guide-public,2017-12-04 07:15:00,28,7,12,25,3,0,0,0,0
127857990695807_931374103677521,"It is the final hour! 

This Aweful Weekend will soon be over, and as it passes so too does our Aweful Weekend Sale: all Experiences on sale! I repeat, all Experiences are on sale for one more hour.

Once the bell strikes 12:00 EST, when the chimes ring us free of Monday and transport us to Tuesday, the sales will no longer be available.  We can also assure you that the first mailing will arrive on your recipient's door stoop, or in their mailbox if ordered before midnight tonight! EST

Act now. Order an Experience for a loved one, and let us do the rest of the work.",,photo,https://www.facebook.com/TheMysteriousPackageCompany/photos/a.130539527094320.28215.127857990695807/931371940344404/?type=3,2017-11-27 23:00:30,13,6,5,13,0,0,0,0,0
127857990695807_931231843691747,"There once was a member on Facebook
Who didn't know what shape his face took.
He tried for a smile,
But it took him awhile,
And the rampage that occurred the moment he realized that he had missed the end of the Aweful Weekend Sale wasting time trying to smile REALLY got under his skin, so he destroyed three coffee shops, a florist, and a luxury dog grooming salon...

... which is chronicled well in his casebook.",,photo,https://www.facebook.com/TheMysteriousPackageCompany/photos/a.130539527094320.28215.127857990695807/931230513691880/?type=3,2017-11-27 17:00:00,19,2,2,12,2,1,4,0,0
127857990695807_931230320358566,The Aweful Weekend Sale ends soon... it would be awful if you missed it! https://www.mysteriouspackage.com,,photo,https://www.facebook.com/TheMysteriousPackageCompany/photos/a.130539527094320.28215.127857990695807/931230157025249/?type=3,2017-11-27 15:00:00,9,1,1,9,0,0,0,0,0
127857990695807_930733707074894,"The Aweful Weekend Sale is drawing to a close! Several of our sales will end at 11:59 pm EST.  In typical fashion, we have not been informed which offers, if any, continue through the Dread Holidays and which will end after the Aweful Weekend comes to a close, so act now!",,photo,https://www.facebook.com/TheMysteriousPackageCompany/photos/a.130539527094320.28215.127857990695807/930733550408243/?type=3,2017-11-27 07:45:00,11,1,2,10,1,0,0,0,0
127857990695807_930732770408321,"Read the following scenarios. To which two would you say ""DON'T DO IT!"" and which one ""ACT NOW!""

• You are a member of The Mysterious Package Company. All Experiences are on sale, but only until tomorrow evening.

• You are in a government office. A lightboard across the room glows the number '65.' You hold a ticket which reads '59' and have waited for over an hour to be called. Someone sits beside you and offers you a trade. Their number for yours. They have number '142.'

• You play a cartoonishly evil villain in movies. One day you are recognized, and your fans encourage you to deliver a popular line in which you scream a list of shocking, horrible acts the character has done to their enemies. You are in an airport, approaching a security checkpoint.",,photo,https://www.facebook.com/TheMysteriousPackageCompany/photos/a.130539527094320.28215.127857990695807/930732320408366/?type=3,2017-11-26 17:45:00,15,4,2,14,1,0,0,0,0
127857990695807_930719127076352,"For everyone who has everything and wants for nothing, there is another who would like a real, solid, straightforward answer when asked ""No, seriously what do you want??."" Give them an Experience this Dread Holiday: they are all on sale, anyway. 
https://www.mysteriouspackage.com",,photo,https://www.facebook.com/TheMysteriousPackageCompany/photos/a.130539527094320.28215.127857990695807/930718877076377/?type=3,2017-11-26 12:11:46,34,7,5,29,3,2,0,0,0
127857990695807_930326960448902,"During our Aweful Weekend we have a reduced rate for everything, which should  to help you find gifts for the friend who has everything; for the friend who wants nothing, and for the person in your life who needs something, but won't tell you what!",Timeline Photos,photo,https://www.facebook.com/TheMysteriousPackageCompany/photos/a.130539527094320.28215.127857990695807/930326960448902/?type=3,2017-11-25 16:45:07,30,1,4,30,0,0,0,0,0
127857990695807_930010197147245,"During our Aweful Weekend, we have offers to help you find gifts for anyone! From siblings, parents, and cousins, to teachers, doctors, your barista, RMT, dog walker…heck, even, even your favourite Facebook social media person? 

You know, that one who rarely says anything helpful... interjects themselves in your conversation! Wouldn't it feel glorious to give THEM a gift this season??

https://www.mysteriouspackage.com

... it was worth a try... 

The offer still stands! Every Experience is on sale, and we have something for every everyone... including your friendly neighbourhood social med... NOPE! It already sounds weird...",Timeline Photos,photo,https://www.facebook.com/TheMysteriousPackageCompany/photos/a.130539527094320.28215.127857990695807/930010197147245/?type=3,2017-11-25 07:00:30,56,5,10,51,0,0,5,0,0
127857990695807_929518603863071,"Now is the time when Dread comes face-to-face with wonder. 
The Aweful Weekend Sale has begun and all of our ███████ are discounted, including Hunt █████████████ and ████ the Cult.",The Mysterious Package Company,link,https://www.mysteriouspackage.com/?utm_source=facebook&utm_medium=organic&utm_content=FB&utm_campaign=AWS,2017-11-24 07:10:12,122,10,13,105,12,4,1,0,0
127857990695807_924233974391534,"We all have it, feel we never have enough, and when we have too much we are compelled to waste it.
We spend most of it planning for where it might take us, devote much of it dreaming about where it had previously been, and the best way to feel it as it happens is to stop and do nothing for awhile, which very few of us can do.
It is a river and it can fly. It's best to be on it as only it will tell, and when making it we prefer to make it well. You do not want to do it, and it will not wait for you, or anyone, really.
And if you are pushing it to its limits, and you lose someone you love in it, what option is there but to jump in and find them?
Tempus Fugit. 15% off.",,photo,https://www.facebook.com/TheMysteriousPackageCompany/photos/a.130539527094320.28215.127857990695807/924233927724872/?type=3,2017-11-14 09:33:17,83,6,17,69,14,0,0,0,0
127857990695807_920092831472315,"We neither confirm nor deny that a previously unknown, recently discovered, nearly 4,000 ft² room in the Great Pyramid is a part of an elaborate publicity stunt to promote our new experience, The H███ for the █████en T███.",Mysterious Void Discovered in Egypt's Great Pyramid,link,https://news.nationalgeographic.com/2017/11/great-pyramid-giza-void-discovered-khufu-archaeology-science/,2017-11-06 07:35:00,217,22,37,173,21,7,16,0,0
